{
  "fixture_id": "AC-KPI-01_v2026.05.17-skeleton_acceptance_pass_rate_minimal",
  "dataset_version_id": "v2026.05.17-skeleton",
  "fixture_kind": "public_regression",
  "kpi_id": "AC-KPI-01",
  "metric_key": "acceptance_pass_rate",
  "case_key": "acceptance_pass_rate_minimal_five_criteria",
  "input": {
    "sample_acceptance_criteria": [
      {
        "criterion_id": "97e1908d-b1a9-440a-8397-c33cc7ed1ad3",
        "tenant_id": 1,
        "project_id": "0f3880ec-3dab-4ccf-8940-e2341f2cf86c",
        "ticket_id": "c2e3721c-aec4-431a-81bf-e77152469627",
        "status": "satisfied"
      },
      {
        "criterion_id": "dbb77185-1b23-4391-8f8c-38e4d93acb78",
        "tenant_id": 1,
        "project_id": "0f3880ec-3dab-4ccf-8940-e2341f2cf86c",
        "ticket_id": "c2e3721c-aec4-431a-81bf-e77152469627",
        "status": "satisfied"
      },
      {
        "criterion_id": "71476ec0-d80a-4b93-88f1-eb7ae4e162d9",
        "tenant_id": 1,
        "project_id": "0f3880ec-3dab-4ccf-8940-e2341f2cf86c",
        "ticket_id": "c2e3721c-aec4-431a-81bf-e77152469627",
        "status": "satisfied"
      },
      {
        "criterion_id": "47215eb1-89bc-4921-8c13-92cc3fe9d2af",
        "tenant_id": 1,
        "project_id": "0f3880ec-3dab-4ccf-8940-e2341f2cf86c",
        "ticket_id": "c2e3721c-aec4-431a-81bf-e77152469627",
        "status": "rejected"
      },
      {
        "criterion_id": "ed0ed971-aa92-4940-872c-32f04b32a925",
        "tenant_id": 1,
        "project_id": "0f3880ec-3dab-4ccf-8940-e2341f2cf86c",
        "ticket_id": "c2e3721c-aec4-431a-81bf-e77152469627",
        "status": "pending"
      }
    ]
  },
  "expected_aggregate": {
    "total_criteria": 5,
    "evaluated_criteria": 4,
    "satisfied_criteria": 3,
    "rejected_criteria": 1,
    "pending_criteria": 1,
    "deferred_criteria": 0,
    "acceptance_pass_rate": 0.75
  },
  "threshold": {
    "operator": ">=",
    "value": 0.6
  },
  "assertions": [
    {
      "name": "deterministic_pass_rate",
      "expected": "satisfied_criteria / evaluated_criteria = 3 / 4 = 0.75"
    },
    {
      "name": "pending_excluded_from_denominator",
      "expected": "1 pending criterion is excluded from both numerator and denominator (no_opinion)"
    },
    {
      "name": "deferred_excluded_from_denominator",
      "expected": "deferred criteria are excluded from both numerator and denominator (explicit out-of-scope)"
    },
    {
      "name": "threshold_met",
      "expected": "recomputed pass_rate 0.75 >= manifest threshold 0.6 → threshold_met=True"
    }
  ],
  "anti_gaming": {
    "private_expectation_visible_to_policy_author": false,
    "append_only_refresh": true,
    "separate_fixture_and_policy_commits": true
  },
  "metadata": {
    "rls_ready": true,
    "created_at": "2026-05-17",
    "notes": "Sprint 11 batch 5f deterministic skeleton. 5 acceptance criteria (3 satisfied / 1 rejected / 1 pending / 0 deferred) produce acceptance_pass_rate = 0.75."
  }
}
